<?xml version="1.0" encoding="UTF-8"?>
<xwebgen-specification xmlns:xsi="http://www.w3.org/2001/XMLSchema-instance"
  xsi:schemaLocation="http://www.xtpxlib.nl/ns/xwebgen ../xsd/xwebgen-specification.xsd" xmlns="http://www.xtpxlib.nl/ns/xwebgen"
  xmlns:xtlwg="http://www.xtpxlib.nl/ns/xwebgen">

  <base-input-dir xtlwg:lang="en" dref-source-dir="source-en"/>
  <base-input-dir xtlwg:lang="nl" dref-source-dir="source-nl"/>

  <base-output-dir xtlwg:lang="en" dref-target-dir="target-en"/>
  <base-output-dir xtlwg:lang="nl" dref-target-dir="target-nl"/>

  <template id="t1" dref-source="templates/template1.xml"/>

  <page dref-section-document="data/x1.xml" dref-target="x1.html" template-idref="t1">
    <properties>
      <property id="p1">TESTP1</property>
    </properties>
  </page>

  <copy-dir dref-source-dir="images"/>

  <properties>
    <property id="p1">TESTP1GLOBAL</property>
  </properties>

</xwebgen-specification>
